id,onet_code,job_title,sector,12th_stream,primary_riasec,secondary_riasec,core_skills,cached_at
644,51-4081.00,"Multiple Machine Tool Setters, Operators, and Tenders, Metal and Plastic",Manufacturing,Vocational,R,C,"Operations Monitoring, Quality Control Analysis, Equipment Maintenance, Judgment and Decision Making, Monitoring, Operation and Control",2026-03-22 08:13:56.541203+00
645,25-4013.00,Museum Technicians and Conservators,Education,Arts,R,C,"Active Listening, Reading Comprehension, Speaking, Critical Thinking, Writing, Complex Problem Solving",2026-03-22 08:13:57.142081+00
646,27-2041.00,Music Directors and Composers,Creative Arts,Arts,A,E,"Active Listening, Speaking, Critical Thinking, Judgment and Decision Making, Reading Comprehension, Active Learning",2026-03-22 08:13:57.757736+00
647,29-1129.02,Music Therapists,Healthcare,Science,S,A,"Social Perceptiveness, Active Listening, Critical Thinking, Reading Comprehension, Service Orientation, Speaking",2026-03-22 08:13:58.357701+00
648,49-9063.00,Musical Instrument Repairers and Tuners,Maintenance & Repair,Vocational,R,C,"Quality Control Analysis, Repairing, Troubleshooting, Critical Thinking, Complex Problem Solving, Judgment and Decision Making",2026-03-22 08:13:58.963633+00
649,27-2042.00,Musicians and Singers,Creative Arts,Arts,A,E,"Speaking, Active Listening, Monitoring, Reading Comprehension, Social Perceptiveness, Coordination",2026-03-22 08:13:59.56655+00
650,39-9011.01,Nannies,Personal Services,Vocational,S,I,"Active Listening, Monitoring, Social Perceptiveness, Service Orientation, Speaking, Critical Thinking",2026-03-22 08:14:00.162244+00
651,17-2199.09,Nanosystems Engineers,Engineering,Science,I,R,"Critical Thinking, Reading Comprehension, Science, Speaking, Active Learning, Active Listening",2026-03-22 08:14:00.768943+00
652,17-3026.01,Nanotechnology Engineering Technologists and Technicians,Engineering,Science,R,I,"Reading Comprehension, Critical Thinking, Writing, Active Listening, Complex Problem Solving, Science",2026-03-22 08:14:01.432256+00
653,11-9121.00,Natural Sciences Managers,Management,Commerce,I,E,"Science, Active Listening, Critical Thinking, Monitoring, Reading Comprehension, Complex Problem Solving",2026-03-22 08:14:02.02684+00
654,29-1299.01,Naturopathic Physicians,Healthcare,Science,I,S,"Reading Comprehension, Active Listening, Critical Thinking, Speaking, Judgment and Decision Making, Social Perceptiveness",2026-03-22 08:14:02.634614+00
655,15-1244.00,Network and Computer Systems Administrators,Technology,Science,C,R,"Critical Thinking, Judgment and Decision Making, Reading Comprehension, Systems Analysis, Active Listening, Complex Problem Solving",2026-03-22 08:14:03.228365+00
656,29-2099.01,Neurodiagnostic Technologists,Healthcare,Science,I,R,"Active Listening, Speaking, Critical Thinking, Reading Comprehension, Monitoring, Writing",2026-03-22 08:14:03.830017+00
657,29-1217.00,Neurologists,Healthcare,Science,I,S,"Active Listening, Complex Problem Solving, Critical Thinking, Reading Comprehension, Social Perceptiveness, Speaking",2026-03-22 08:14:04.422766+00
658,19-3039.02,Neuropsychologists,Research & Science,Science,I,S,"Active Listening, Reading Comprehension, Writing, Critical Thinking, Judgment and Decision Making, Speaking",2026-03-22 08:14:05.119298+00
659,43-4141.00,New Accounts Clerks,Administration,Commerce,C,E,"Active Listening, Speaking, Reading Comprehension, Service Orientation, Social Perceptiveness, Coordination",2026-03-22 08:14:05.718527+00
660,27-3023.00,"News Analysts, Reporters, and Journalists",Creative Arts,Arts,A,I,"Speaking, Reading Comprehension, Writing, Active Listening, Social Perceptiveness, Time Management",2026-03-22 08:14:06.317067+00
661,17-3029.01,Non-Destructive Testing Specialists,Engineering,Science,R,I,"Quality Control Analysis, Reading Comprehension, Active Listening, Critical Thinking, Monitoring, Active Learning",2026-03-22 08:14:06.913025+00
662,17-2161.00,Nuclear Engineers,Engineering,Science,I,R,"Critical Thinking, Science, Active Listening, Complex Problem Solving, Judgment and Decision Making, Mathematics",2026-03-22 08:14:07.512336+00
663,29-2033.00,Nuclear Medicine Technologists,Healthcare,Science,R,I,"Critical Thinking, Active Listening, Speaking, Monitoring, Reading Comprehension, Writing",2026-03-22 08:14:08.100471+00
664,19-4051.02,Nuclear Monitoring Technicians,Research & Science,Science,R,C,"Active Listening, Critical Thinking, Monitoring, Operations Monitoring, Reading Comprehension, Speaking",2026-03-22 08:14:08.69352+00
665,51-8011.00,Nuclear Power Reactor Operators,Manufacturing,Vocational,R,C,"Operation and Control, Operations Monitoring, Reading Comprehension, Active Listening, Critical Thinking, Monitoring",2026-03-22 08:14:09.300681+00
666,19-4051.00,Nuclear Technicians,Research & Science,Science,R,C,"Operations Monitoring, Monitoring, Active Listening, Critical Thinking, Reading Comprehension, Quality Control Analysis",2026-03-22 08:14:09.895682+00
667,29-1151.00,Nurse Anesthetists,Healthcare,Science,S,I,"Critical Thinking, Reading Comprehension, Active Learning, Active Listening, Complex Problem Solving, Judgment and Decision Making",2026-03-22 08:14:10.493809+00
668,29-1161.00,Nurse Midwives,Healthcare,Science,S,I,"Active Listening, Critical Thinking, Social Perceptiveness, Speaking, Active Learning, Monitoring",2026-03-22 08:14:11.092754+00
669,29-1171.00,Nurse Practitioners,Healthcare,Science,I,S,"Active Listening, Complex Problem Solving, Critical Thinking, Reading Comprehension, Active Learning, Judgment and Decision Making",2026-03-22 08:14:11.682147+00
670,31-1131.00,Nursing Assistants,Healthcare,Science,S,R,"Service Orientation, Active Listening, Social Perceptiveness, Monitoring, Coordination, Critical Thinking",2026-03-22 08:14:12.287727+00
671,25-1072.00,"Nursing Instructors and Teachers, Postsecondary",Education,Arts,S,I,"Instructing, Learning Strategies, Speaking, Active Listening, Reading Comprehension, Writing",2026-03-22 08:14:12.889095+00
672,29-1218.00,Obstetricians and Gynecologists,Healthcare,Science,I,S,"Critical Thinking, Reading Comprehension, Active Learning, Active Listening, Complex Problem Solving, Judgment and Decision Making",2026-03-22 08:14:13.555188+00
673,19-5011.00,Occupational Health and Safety Specialists,Research & Science,Science,I,C,"Active Listening, Reading Comprehension, Speaking, Writing, Complex Problem Solving, Critical Thinking",2026-03-22 08:14:14.149062+00
674,19-5012.00,Occupational Health and Safety Technicians,Research & Science,Science,C,R,"Active Listening, Critical Thinking, Reading Comprehension, Speaking, Writing, Complex Problem Solving",2026-03-22 08:14:14.739188+00
675,29-1122.00,Occupational Therapists,Healthcare,Science,S,I,"Active Listening, Monitoring, Service Orientation, Critical Thinking, Instructing, Judgment and Decision Making",2026-03-22 08:14:15.340677+00
676,31-2012.00,Occupational Therapy Aides,Healthcare,Science,S,R,"Service Orientation, Social Perceptiveness, Speaking, Active Listening, Coordination, Critical Thinking",2026-03-22 08:14:15.934591+00
677,31-2011.00,Occupational Therapy Assistants,Healthcare,Science,S,C,"Active Listening, Service Orientation, Social Perceptiveness, Speaking, Reading Comprehension, Time Management",2026-03-22 08:14:16.541158+00
678,43-9199.00,"Office and Administrative Support Workers, All Other",Administration,Commerce,R,I,,2026-03-22 08:14:17.143407+00
679,43-9061.00,"Office Clerks, General",Administration,Commerce,C,I,"Active Listening, Reading Comprehension, Speaking, Writing, Coordination, Critical Thinking",2026-03-22 08:14:17.743204+00
680,43-9071.00,"Office Machine Operators, Except Computer",Administration,Commerce,C,R,"Operation and Control, Operations Monitoring, Reading Comprehension, Active Listening, Critical Thinking, Judgment and Decision Making",2026-03-22 08:14:18.33117+00
681,13-1199.06,Online Merchants,Finance,Commerce,C,E,"Reading Comprehension, Active Listening, Critical Thinking, Speaking, Persuasion, Service Orientation",2026-03-22 08:14:18.955271+00
682,47-2073.00,Operating Engineers and Other Construction Equipment Operators,Construction,Vocational,R,C,"Operation and Control, Equipment Maintenance, Operations Monitoring, Monitoring, Active Listening, Time Management",2026-03-22 08:14:19.550808+00
683,15-2031.00,Operations Research Analysts,Technology,Science,I,C,"Mathematics, Complex Problem Solving, Active Listening, Critical Thinking, Reading Comprehension, Speaking",2026-03-22 08:14:20.142088+00
684,51-9083.00,Ophthalmic Laboratory Technicians,Manufacturing,Vocational,R,C,"Operation and Control, Operations Monitoring, Quality Control Analysis, Time Management, Critical Thinking, Judgment and Decision Making",2026-03-22 08:14:20.737384+00
685,29-2057.00,Ophthalmic Medical Technicians,Healthcare,Science,R,I,"Active Listening, Speaking, Reading Comprehension, Service Orientation, Social Perceptiveness, Writing",2026-03-22 08:14:21.342715+00
686,29-2099.05,Ophthalmic Medical Technologists,Healthcare,Science,R,C,"Active Listening, Speaking, Social Perceptiveness, Service Orientation, Critical Thinking, Coordination",2026-03-22 08:14:21.941272+00
687,29-1241.00,"Ophthalmologists, Except Pediatric",Healthcare,Science,I,S,"Critical Thinking, Reading Comprehension, Active Listening, Active Learning, Complex Problem Solving, Judgment and Decision Making",2026-03-22 08:14:22.53217+00
688,29-2081.00,"Opticians, Dispensing",Healthcare,Science,C,R,"Speaking, Active Listening, Reading Comprehension, Critical Thinking, Service Orientation, Coordination",2026-03-22 08:14:23.134047+00
689,29-1041.00,Optometrists,Healthcare,Science,I,S,"Active Listening, Critical Thinking, Reading Comprehension, Speaking, Writing, Social Perceptiveness",2026-03-22 08:14:23.729763+00
690,29-1022.00,Oral and Maxillofacial Surgeons,Healthcare,Science,I,R,"Complex Problem Solving, Judgment and Decision Making, Critical Thinking, Reading Comprehension, Active Learning, Active Listening",2026-03-22 08:14:24.325438+00
691,43-4151.00,Order Clerks,Administration,Commerce,C,E,"Active Listening, Speaking, Reading Comprehension, Service Orientation, Critical Thinking, Judgment and Decision Making",2026-03-22 08:14:24.924622+00
692,31-1132.00,Orderlies,Healthcare,Science,R,C,"Service Orientation, Social Perceptiveness, Active Listening, Speaking",2026-03-22 08:14:25.527739+00
693,29-1023.00,Orthodontists,Healthcare,Science,I,R,"Active Listening, Complex Problem Solving, Critical Thinking, Monitoring, Speaking, Coordination",2026-03-22 08:14:26.12082+00
694,29-1242.00,"Orthopedic Surgeons, Except Pediatric",Healthcare,Science,I,R,,2026-03-22 08:14:26.815826+00
695,29-1299.02,Orthoptists,Healthcare,Science,I,R,"Active Listening, Critical Thinking, Speaking, Social Perceptiveness, Reading Comprehension, Science",2026-03-22 08:14:27.404622+00
696,29-2091.00,Orthotists and Prosthetists,Healthcare,Science,R,I,"Active Listening, Critical Thinking, Reading Comprehension, Speaking, Writing, Active Learning",2026-03-22 08:14:28.013883+00
697,49-3053.00,Outdoor Power Equipment and Other Small Engine Mechanics,Maintenance & Repair,Vocational,R,C,"Equipment Maintenance, Repairing, Troubleshooting, Operations Monitoring, Critical Thinking, Equipment Selection",2026-03-22 08:14:28.61748+00
698,51-9111.00,Packaging and Filling Machine Operators and Tenders,Manufacturing,Vocational,R,C,"Operations Monitoring, Monitoring, Active Listening, Coordination, Operation and Control",2026-03-22 08:14:29.212001+00
699,53-7064.00,"Packers and Packagers, Hand",Logistics & Transport,Vocational,R,C,Monitoring,2026-03-22 08:14:29.800157+00
700,47-2141.00,"Painters, Construction and Maintenance",Construction,Vocational,R,C,"Active Listening, Critical Thinking, Time Management",2026-03-22 08:14:30.39198+00
701,51-9123.00,"Painting, Coating, and Decorating Workers",Manufacturing,Vocational,R,A,,2026-03-22 08:14:30.9885+00
702,51-9196.00,"Paper Goods Machine Setters, Operators, and Tenders",Manufacturing,Vocational,R,C,"Operations Monitoring, Operation and Control, Quality Control Analysis, Active Listening, Critical Thinking, Monitoring",2026-03-22 08:14:31.585127+00
703,47-2142.00,Paperhangers,Construction,Vocational,R,C,"Active Listening, Coordination, Speaking",2026-03-22 08:14:32.188594+00
704,23-2011.00,Paralegals and Legal Assistants,Legal Services,Commerce,C,I,"Writing, Active Listening, Reading Comprehension, Speaking, Critical Thinking, Active Learning",2026-03-22 08:14:32.789751+00
705,29-2043.00,Paramedics,Healthcare,Science,S,R,,2026-03-22 08:14:33.383829+00
706,19-1031.03,Park Naturalists,Research & Science,Science,S,R,"Speaking, Active Listening, Reading Comprehension, Social Perceptiveness, Writing, Critical Thinking",2026-03-22 08:14:33.984872+00
707,53-6021.00,Parking Attendants,Logistics & Transport,Vocational,R,C,"Speaking, Service Orientation, Active Listening, Social Perceptiveness",2026-03-22 08:14:34.586048+00
708,33-3041.00,Parking Enforcement Workers,Public Safety,Vocational,R,C,"Monitoring, Speaking, Active Listening, Critical Thinking, Social Perceptiveness, Coordination",2026-03-22 08:14:35.180973+00
709,41-2022.00,Parts Salespersons,Sales,Commerce,R,C,"Active Listening, Speaking, Persuasion, Reading Comprehension, Service Orientation, Social Perceptiveness",2026-03-22 08:14:35.773787+00
710,53-6061.00,Passenger Attendants,Logistics & Transport,Vocational,C,S,"Service Orientation, Active Listening, Social Perceptiveness, Speaking, Monitoring, Coordination",2026-03-22 08:14:36.376325+00
711,29-2099.08,Patient Representatives,Healthcare,Science,S,I,"Active Listening, Service Orientation, Social Perceptiveness, Coordination, Reading Comprehension, Speaking",2026-03-22 08:14:36.967307+00
712,51-4062.00,"Patternmakers, Metal and Plastic",Manufacturing,Vocational,R,C,"Operations Monitoring, Operation and Control, Quality Control Analysis, Active Listening, Complex Problem Solving, Critical Thinking",2026-03-22 08:14:37.574069+00
713,51-7032.00,"Patternmakers, Wood",Manufacturing,Vocational,R,A,"Complex Problem Solving, Monitoring, Operation and Control, Operations Monitoring, Reading Comprehension, Active Listening",2026-03-22 08:14:38.168543+00
714,47-2071.00,"Paving, Surfacing, and Tamping Equipment Operators",Construction,Vocational,R,C,"Operations Monitoring, Operation and Control, Monitoring, Coordination, Critical Thinking, Repairing",2026-03-22 08:14:38.765655+00
715,43-3051.00,Payroll and Timekeeping Clerks,Administration,Commerce,C,E,"Reading Comprehension, Active Listening, Mathematics, Critical Thinking, Speaking, Writing",2026-03-22 08:14:39.35709+00
716,29-1243.00,Pediatric Surgeons,Healthcare,Science,I,S,,2026-03-22 08:14:39.941303+00
717,29-1221.00,"Pediatricians, General",Healthcare,Science,S,I,"Critical Thinking, Judgment and Decision Making, Speaking, Active Listening, Reading Comprehension, Active Learning",2026-03-22 08:14:40.529481+00
718,15-1299.04,Penetration Testers,Technology,Science,I,C,,2026-03-22 08:14:41.128321+00
719,31-1122.00,Personal Care Aides,Healthcare,Science,S,C,"Service Orientation, Social Perceptiveness, Active Listening, Critical Thinking, Monitoring, Coordination",2026-03-22 08:14:41.727945+00
720,39-9099.00,"Personal Care and Service Workers, All Other",Personal Services,Vocational,R,I,,2026-03-22 08:14:42.321109+00
721,13-2052.00,Personal Financial Advisors,Finance,Commerce,E,C,"Active Listening, Reading Comprehension, Speaking, Writing, Critical Thinking, Complex Problem Solving",2026-03-22 08:14:42.913329+00
722,11-9179.00,"Personal Service Managers, All Other",Management,Commerce,R,I,,2026-03-22 08:14:43.510261+00
723,37-2021.00,Pest Control Workers,Maintenance & Repair,Vocational,R,C,"Active Listening, Critical Thinking, Monitoring, Speaking, Writing, Time Management",2026-03-22 08:14:44.104637+00
724,37-3012.00,"Pesticide Handlers, Sprayers, and Applicators, Vegetation",Maintenance & Repair,Vocational,R,C,"Active Listening, Critical Thinking, Speaking, Time Management, Complex Problem Solving, Coordination",2026-03-22 08:14:44.712972+00
725,17-2171.00,Petroleum Engineers,Engineering,Science,R,I,"Critical Thinking, Reading Comprehension, Active Listening, Complex Problem Solving, Judgment and Decision Making, Speaking",2026-03-22 08:14:45.304598+00
726,51-8093.00,"Petroleum Pump System Operators, Refinery Operators, and Gaugers",Manufacturing,Vocational,R,C,"Operations Monitoring, Operation and Control, Monitoring, Reading Comprehension, Complex Problem Solving, Speaking",2026-03-22 08:14:45.904545+00
727,29-1051.00,Pharmacists,Healthcare,Science,I,S,"Active Listening, Reading Comprehension, Speaking, Critical Thinking, Monitoring, Writing",2026-03-22 08:14:46.512566+00
728,31-9095.00,Pharmacy Aides,Healthcare,Science,C,E,"Active Listening, Service Orientation, Speaking, Reading Comprehension, Social Perceptiveness, Coordination",2026-03-22 08:14:47.118545+00
729,29-2052.00,Pharmacy Technicians,Healthcare,Science,C,R,"Active Listening, Reading Comprehension, Speaking, Critical Thinking, Active Learning, Complex Problem Solving",2026-03-22 08:14:47.713905+00
730,25-1126.00,"Philosophy and Religion Teachers, Postsecondary",Education,Arts,S,I,"Reading Comprehension, Active Listening, Instructing, Speaking, Critical Thinking, Writing",2026-03-22 08:14:48.320091+00
731,31-9097.00,Phlebotomists,Healthcare,Science,R,C,"Service Orientation, Social Perceptiveness, Active Listening, Speaking, Critical Thinking, Coordination",2026-03-22 08:14:48.924597+00
732,27-4021.00,Photographers,Creative Arts,Arts,R,A,"Active Listening, Speaking, Service Orientation, Active Learning, Complex Problem Solving, Critical Thinking",2026-03-22 08:14:49.523244+00
733,51-9151.00,Photographic Process Workers and Processing Machine Operators,Manufacturing,Vocational,R,C,"Operations Monitoring, Active Listening, Quality Control Analysis, Reading Comprehension, Service Orientation, Speaking",2026-03-22 08:14:50.125601+00
734,17-2199.07,Photonics Engineers,Engineering,Science,R,I,"Critical Thinking, Reading Comprehension, Writing, Active Listening, Active Learning, Mathematics",2026-03-22 08:14:50.715141+00
735,17-3029.08,Photonics Technicians,Engineering,Science,R,C,"Reading Comprehension, Active Listening, Critical Thinking, Operations Monitoring, Quality Control Analysis, Active Learning",2026-03-22 08:14:51.309458+00
736,29-1229.04,Physical Medicine and Rehabilitation Physicians,Healthcare,Science,I,S,"Critical Thinking, Active Listening, Reading Comprehension, Social Perceptiveness, Speaking, Judgment and Decision Making",2026-03-22 08:14:51.920589+00
737,19-2099.00,"Physical Scientists, All Other",Research & Science,Science,R,I,,2026-03-22 08:14:52.522694+00
738,31-2022.00,Physical Therapist Aides,Healthcare,Science,S,R,"Active Listening, Monitoring, Service Orientation, Coordination, Reading Comprehension, Social Perceptiveness",2026-03-22 08:14:53.123006+00
739,31-2021.00,Physical Therapist Assistants,Healthcare,Science,S,R,"Active Listening, Monitoring, Social Perceptiveness, Speaking, Active Learning, Critical Thinking",2026-03-22 08:14:53.722657+00
740,29-1123.00,Physical Therapists,Healthcare,Science,S,I,"Active Listening, Critical Thinking, Reading Comprehension, Service Orientation, Social Perceptiveness, Speaking",2026-03-22 08:14:54.328128+00
741,29-1071.00,Physician Assistants,Healthcare,Science,S,I,"Critical Thinking, Reading Comprehension, Active Listening, Judgment and Decision Making, Service Orientation, Social Perceptiveness",2026-03-22 08:14:54.926639+00
742,29-1229.00,"Physicians, All Other",Healthcare,Science,R,I,,2026-03-22 08:14:55.525974+00
743,29-1222.00,"Physicians, Pathologists",Healthcare,Science,I,R,"Reading Comprehension, Critical Thinking, Writing, Active Learning, Active Listening, Complex Problem Solving",2026-03-22 08:14:56.133627+00
744,19-2012.00,Physicists,Research & Science,Science,I,R,"Science, Mathematics, Reading Comprehension, Critical Thinking, Speaking, Active Learning",2026-03-22 08:14:56.738492+00
745,25-1054.00,"Physics Teachers, Postsecondary",Education,Arts,S,I,"Instructing, Reading Comprehension, Science, Speaking, Active Learning, Active Listening",2026-03-22 08:14:57.401041+00
746,47-2072.00,Pile Driver Operators,Construction,Vocational,R,C,"Operation and Control, Operations Monitoring, Equipment Maintenance, Monitoring, Troubleshooting, Active Listening",2026-03-22 08:14:57.998473+00
747,47-2151.00,Pipelayers,Construction,Vocational,R,C,"Operation and Control, Active Listening, Coordination, Critical Thinking, Operations Monitoring, Quality Control Analysis",2026-03-22 08:14:58.607514+00
748,51-8099.00,"Plant and System Operators, All Other",Manufacturing,Vocational,R,I,,2026-03-22 08:14:59.191384+00
749,47-2161.00,Plasterers and Stucco Masons,Construction,Vocational,R,C,"Active Listening, Quality Control Analysis, Time Management",2026-03-22 08:14:59.795751+00
750,51-4193.00,"Plating Machine Setters, Operators, and Tenders, Metal and Plastic",Manufacturing,Vocational,R,C,"Operations Monitoring, Active Listening, Monitoring, Operation and Control, Reading Comprehension, Coordination",2026-03-22 08:15:00.401358+00
751,47-2152.00,"Plumbers, Pipefitters, and Steamfitters",Construction,Vocational,R,C,"Critical Thinking, Judgment and Decision Making, Repairing, Troubleshooting, Monitoring, Complex Problem Solving",2026-03-22 08:15:00.994699+00
752,29-1081.00,Podiatrists,Healthcare,Science,I,R,"Active Learning, Active Listening, Critical Thinking, Reading Comprehension, Speaking, Judgment and Decision Making",2026-03-22 08:15:01.615222+00
753,27-3043.05,"Poets, Lyricists and Creative Writers",Creative Arts,Arts,A,I,"Writing, Reading Comprehension, Speaking, Active Learning, Critical Thinking, Active Listening",2026-03-22 08:15:02.21492+00
754,33-3051.00,Police and Sheriff's Patrol Officers,Public Safety,Vocational,R,C,"Active Listening, Social Perceptiveness, Speaking, Active Learning, Critical Thinking, Coordination",2026-03-22 08:15:02.812149+00
755,33-3021.02,Police Identification and Records Officers,Public Safety,Vocational,C,R,"Active Listening, Speaking, Critical Thinking, Reading Comprehension, Writing, Active Learning",2026-03-22 08:15:03.474169+00
756,25-1065.00,"Political Science Teachers, Postsecondary",Education,Arts,S,I,"Speaking, Reading Comprehension, Active Learning, Active Listening, Instructing, Writing",2026-03-22 08:15:04.089097+00
757,19-3094.00,Political Scientists,Research & Science,Science,I,A,"Reading Comprehension, Active Learning, Active Listening, Speaking, Critical Thinking, Writing",2026-03-22 08:15:04.688512+00
758,43-5051.00,Postal Service Clerks,Administration,Commerce,C,R,"Active Listening, Speaking, Reading Comprehension, Service Orientation, Critical Thinking, Monitoring",2026-03-22 08:15:05.281836+00
759,43-5052.00,Postal Service Mail Carriers,Administration,Commerce,C,R,"Active Listening, Critical Thinking, Social Perceptiveness, Speaking",2026-03-22 08:15:05.879515+00
760,43-5053.00,"Postal Service Mail Sorters, Processors, and Processing Machine Operators",Administration,Commerce,C,R,"Monitoring, Coordination, Critical Thinking, Reading Comprehension, Speaking",2026-03-22 08:15:06.483554+00
761,11-9131.00,Postmasters and Mail Superintendents,Management,Commerce,E,C,"Active Listening, Coordination, Reading Comprehension, Social Perceptiveness, Speaking, Time Management",2026-03-22 08:15:07.083374+00
762,25-1199.00,"Postsecondary Teachers, All Other",Education,Arts,R,I,,2026-03-22 08:15:07.674379+00
763,51-9195.05,"Potters, Manufacturing",Manufacturing,Vocational,R,C,"Operations Monitoring, Operation and Control, Active Listening, Critical Thinking, Monitoring",2026-03-22 08:15:08.279151+00
764,51-4052.00,"Pourers and Casters, Metal",Manufacturing,Vocational,R,C,"Operation and Control, Operations Monitoring, Active Listening, Critical Thinking, Judgment and Decision Making, Monitoring",2026-03-22 08:15:08.875825+00
765,51-8012.00,Power Distributors and Dispatchers,Manufacturing,Vocational,R,C,"Active Listening, Critical Thinking, Monitoring, Reading Comprehension, Speaking, Complex Problem Solving",2026-03-22 08:15:09.471618+00
766,51-8013.00,Power Plant Operators,Manufacturing,Vocational,R,C,"Operations Monitoring, Operation and Control, Critical Thinking, Speaking, Active Listening, Complex Problem Solving",2026-03-22 08:15:10.059826+00
767,19-4012.01,Precision Agriculture Technicians,Research & Science,Science,R,I,"Reading Comprehension, Active Listening, Critical Thinking, Speaking, Writing, Active Learning",2026-03-22 08:15:10.652303+00
768,49-9069.00,"Precision Instrument and Equipment Repairers, All Other",Maintenance & Repair,Vocational,R,I,,2026-03-22 08:15:11.237617+00
769,51-5111.00,Prepress Technicians and Workers,Manufacturing,Vocational,C,R,"Active Listening, Critical Thinking, Monitoring, Speaking, Time Management, Complex Problem Solving",2026-03-22 08:15:11.843103+00
770,25-2011.00,"Preschool Teachers, Except Special Education",Education,Arts,S,A,"Instructing, Speaking, Active Listening, Learning Strategies, Coordination, Critical Thinking",2026-03-22 08:15:12.452536+00
771,51-6021.00,"Pressers, Textile, Garment, and Related Materials",Manufacturing,Vocational,R,C,Operation and Control,2026-03-22 08:15:13.124013+00
772,29-1229.05,Preventive Medicine Physicians,Healthcare,Science,I,S,"Reading Comprehension, Active Listening, Complex Problem Solving, Critical Thinking, Judgment and Decision Making, Speaking",2026-03-22 08:15:13.736005+00
773,51-5113.00,Print Binding and Finishing Workers,Manufacturing,Vocational,C,R,"Operations Monitoring, Critical Thinking, Judgment and Decision Making, Monitoring, Reading Comprehension, Complex Problem Solving",2026-03-22 08:15:14.330037+00
